{
  "schema_version": "1.0.0",
  "suite_id": "doc_traceability.long_docs",
  "purpose": "Ensure every long-form document remains traceable to graph nodes and references.",
  "rules": {
    "required_headers": ["machine_summary_zh:", "machine_summary_en:", "reference_ids:", "node_ids:"],
    "require_all_reference_ids_resolve": true,
    "require_all_node_ids_resolve": true
  }
}

